{
  "$schema": "https://json-schema.org/draft/2020-12/schema",
  "$id": "embedaiassist.config.v1",
  "title": "embed-ai-assist 分层配置（合并后视图）",
  "description": "分层加载合并后的最终配置结构：第 1 步加载根目录 config.json（全局默认），第 2 步加载项目/示例 config.json（覆盖或补充），第 3 步深合并。全局字段来自根配置，项目字段来自项目配置，均为可选。",
  "type": "object",
  "properties": {
    "tool_paths": {
      "type": "object",
      "description": "工具路径（全局层）",
      "properties": {
        "keil": { "type": "string", "description": "Keil UV4.exe 路径" },
        "keil_fromelf": { "type": "string", "description": "Keil fromelf.exe 路径（bin/hex 生成；未配置时 S7a/S7b 从 Keil 根按 ARM/ARMCLANG|ARMCC/bin/ 推导，ARMCLANG 优先）" },
        "iar": { "type": "string", "description": "IAR IarBuild.exe 路径" },
        "iar_ielftool": { "type": "string", "description": "IAR ielftool.exe 路径（bin 生成；未配置时从 IarBuild 同目录 common/bin/ 探测）" },
        "gcc": { "type": "string", "description": "arm-none-eabi-gcc 路径（gcc_make/gcc_cmake 构建系统）" },
        "gcc_objcopy": { "type": "string", "description": "arm-none-eabi-objcopy 路径（bin/hex 生成；未配置时从 gcc 同目录探测）" },
        "make": { "type": "string", "description": "GNU Make 路径（gcc_make 构建系统）" },
        "cmake": { "type": "string", "description": "CMake 路径（gcc_cmake 构建系统）" },
        "vendor_ide": { "type": "string", "description": "厂家 IDE 可执行文件路径（build_system=vendor_ide 时必填）" },
        "jflash": { "type": "string", "description": "J-Flash 可执行文件路径（flash_tool=jflash 时消费；兼作 S9 jlink 工具的 SEGGER 安装目录探测线索——未配置 tool_paths.jlink 时从本键同目录探测 JLink.exe）" },
        "jlink": { "type": "string", "description": "J-Link Commander 路径（JLink.exe，flash_tool=jlink 时消费；未配置时 S9 从 tool_paths.jflash 同目录探测）" },
        "stlink_cli": { "type": "string", "description": "STM32CubeProgrammer CLI 路径（STM32_Programmer_CLI.exe，flash_tool=stlink 时消费，三期演进项）" },
        "openocd": { "type": "string", "description": "OpenOCD 路径（openocd.exe，flash_tool=openocd 时消费，三期演进项）" },
        "pyocd": { "type": "string", "description": "pyOCD 路径（pyocd.exe；未配置时以 tool_paths.python -m pyocd 探测，四期演进项）" },
        "python": { "type": "string", "description": "Python 解释器路径" }
      },
      "additionalProperties": { "type": "string" }
    },
    "platforms_root": {
      "type": "string",
      "description": "芯片资料库根目录（全局层，相对根目录）"
    },
    "skills_root": {
      "type": "string",
      "description": "Skill 根目录（全局层，相对根目录）"
    },
    "platform": {
      "type": "string",
      "description": "目标芯片平台名，对应 platforms/ 下目录（项目层）"
    },
    "project": {
      "type": "object",
      "description": "项目工程选项（项目层；S5a 校验后写入 state.json，S5b/S5c 消费。各 Skill 加载合并配置时统一按本 schema 拦截非法值）",
      "properties": {
        "target": {
          "type": "string",
          "description": "目标平台名（platform 字段的备选写法）"
        },
        "build_target": {
          "type": "string",
          "enum": ["App", "BootLoader"],
          "default": "App",
          "description": "当前开发目标工程（项目层）：决定 state.json/源码目录/outputs/IDE 工程目录归属 Examples/<project>/App/ 或 BootLoader/；docs/schematic/references 为项目根共享，不随目标切换"
        },
        "build_system": {
          "type": ["string", "null"],
          "enum": ["keil", "iar", "gcc_make", "gcc_cmake", "vendor_ide", null],
          "default": null,
          "description": "构建系统（项目层，S7b build 消费）：缺省 null 时 S7b 按工程文件智能推断（*.uvprojx→keil、*.ewp→iar、Makefile→gcc_make、CMakeLists.txt→gcc_cmake，多候选/零候选报错）；vendor_ide=厂家自研 IDE 无 CLI 走 GUI 编译机制（不参与推断，mcu8 平台必须显式配置）"
        },
        "build_config": {
          "type": "string",
          "description": "构建配置名（项目层，S7b build 消费）：Keil target 名 / IAR configuration 名 / CMake config（如 Debug/Release）；缺省推断，多 target/configuration 且未显式配置时 S7b 报错（不猜）"
        },
        "vendor_ide": {
          "type": "string",
          "description": "厂家 IDE 标识（项目层，build_system=vendor_ide 时必填，如 fmd_ft）：用于定位 skills/build/references/vendor_ide/<标识>.md 操作指南"
        },
        "vendor_ide_output_dir": {
          "type": "string",
          "description": "厂家 IDE 编译输出目录（项目层，相对目标工程根；缺省按 vendor 指南推断，如 Project/Output/）"
        },
        "architecture": {
          "type": "string",
          "enum": ["flat", "layered", "full"],
          "default": "layered",
          "description": "软件分层程度：flat=单层平铺；layered=HAL+APP 分层（32 位惯例，缺省）；full=HAL+Port+APP 全分层"
        },
        "arch_family": {
          "type": "string",
          "enum": ["cortex_m", "mcu8"],
          "description": "平台架构族（项目层，可选）：cortex_m=32 位 Cortex-M；mcu8=8 位 MCU。显式指定优先于型号前缀推断（见 docs/PROJECT_LAYOUT.md 2.3 目录选择逻辑）"
        },
        "flash_offset": {
          "type": "integer",
          "minimum": 0,
          "default": 0,
          "description": "App 在 Flash 中的重定向偏移（字节，OTA App 场景，相对 Flash 基址如 0x08000000；缺省 0=无偏移）。消费方：S5b（>0 时生成 sys_port.h 契约并在 main.c 首句显式调用向量表重定位）、S7b（链接脚本 ORIGIN=基址+偏移，LENGTH=总容量-偏移）、S6/S9（bin 拼接位置/烧录目标地址）。仅 cortex_m 的 layered/full 架构生效（flat 无 Port 层，8 位 MCU 无 VTOR）"
        },
        "flash_tool": {
          "type": ["string", "null"],
          "enum": ["jlink", "jflash", "stlink", "openocd", "pyocd", "vendor_ide", null],
          "default": null,
          "description": "烧录工具（项目层，S9 flash 消费）：jlink=J-Link Commander CLI（推荐）；jflash=J-Flash CLI 绑定 .jflash 工程文件（二期，不参与推断）；stlink=STM32CubeProgrammer CLI（三期）；openocd（三期）；pyocd（四期）；vendor_ide=厂家 IDE 无 CLI 走 GUI 烧录机制（五期，不参与推断）。缺省 null 时 S9 智能推断（uvoptx pMon 调试器证据 > tool_paths 可用性+平台惯例，多/零候选/证据工具不可用报错不猜）；arch_family=mcu8 时必须显式配置（不推断）"
        },
        "flash_config": {
          "type": "string",
          "description": ".jflash 工程文件显式路径（项目层，可选；flash_tool=jflash 时消费，搜索优先级 --jflash-project 参数 > 本配置项 > release/*.jflash 约定，二期实现）"
        },
        "rtos": {
          "type": "string",
          "enum": ["none", "FreeRTOS", "RT-Thread", "Zephyr"],
          "default": "none",
          "description": "RTOS 类型：none=裸机（缺省）"
        },
        "power": {
          "type": "object",
          "description": "低功耗设计选项",
          "properties": {
            "enabled": {
              "type": "boolean",
              "default": false,
              "description": "是否启用低功耗设计（缺省 false）"
            }
          },
          "additionalProperties": false
        },
        "inputs": {
          "type": "object",
          "description": "项目输入材料路径（项目层，相对项目根；S2/S5b 消费。docs/schematic/references 为项目根共享）",
          "properties": {
            "functional_spec": {
              "type": "string",
              "description": "功能规格书路径（S2 spec-reader 必选输入；支持 .md/.txt/.docx/.pdf）"
            },
            "software_spec": {
              "type": "string",
              "description": "软件规格书路径（可选；S2 仅登记指针不解析内容，S5b 优先级最高的设计输入）"
            },
            "s5b_design_input": {
              "type": "string",
              "description": "S5b 用户设计输入路径（可选，缺省 docs/s5b_design_input.md）"
            },
            "s5c_design_input": {
              "type": "string",
              "description": "S5c 用户设计输入路径（可选，缺省 docs/s5c_design_input.md；低功耗方案/已有实现参考）"
            },
            "demos": {
              "type": ["string", "array"],
              "description": "demo 程序路径或列表（S5b 代码风格学习材料）"
            },
            "sdk": {
              "type": "string",
              "description": "SDK 目录路径（S5b 参考材料）"
            },
            "existing_project": {
              "type": "string",
              "description": "已有项目路径（S5b 代码风格学习材料）"
            },
            "ide_project": {
              "type": "string",
              "description": "IDE 项目文件路径（S5b 参考；S7b build 赋予编译语义：缺省按工程目录自动发现，build_system=vendor_ide 时必填——GUI 打开的目标）"
            }
          },
          "additionalProperties": false
        }
      },
      "additionalProperties": false
    },
    "s5a": {
      "type": "object",
      "description": "S5a hardware-initializer 专属选项（项目层）",
      "properties": {
        "uart_baudrate": {
          "type": "integer",
          "default": 115200,
          "description": "调试串口波特率（缺省 115200）"
        }
      }
    },
    "s5c": {
      "type": "object",
      "description": "S5c port-implementer 专属选项（项目层）",
      "properties": {
        "platform": {
          "type": "string",
          "description": "平台标识（port_impl_<外设>_<平台>.c 文件命名后缀，小写）；缺省取顶层 platform 小写化"
        },
        "hal_framework": {
          "type": "string",
          "description": "HAL 框架标识（如 std_periph / hal / ll / sdk），用于定位参考材料与 API 写法"
        }
      }
    },
    "schematic_path": {
      "type": "string",
      "description": "原理图文件路径（项目层，相对项目目录）"
    },
    "schematic_format": {
      "type": "string",
      "enum": ["schdoc", "prjpcb", "kicad_sch", "pdf"],
      "description": "原理图输入格式（项目层，可选）：显式指定 schdoc/prjpcb/kicad_sch/pdf；未指定时 S1 按文件扩展名自动识别。与 eda_tool 同时配置时以本字段为准"
    },
    "datasheet_path": {
      "type": "string",
      "description": "芯片数据手册路径（项目层；以 platforms/ 开头时相对根目录，否则相对项目目录）"
    },
    "datasheet_secondary_path": {
      "type": "string",
      "description": "参考手册 PDF 路径（项目层，可选；S3 datasheet-extractor 兜底数据源，仅在无 SVD 时用于提取寄存器映射/时钟树/外设清单；路径解析规则同 datasheet_path）"
    },
    "svd_path": {
      "type": "string",
      "description": "CMSIS-SVD 文件路径（项目层，可选但推荐；S3 数据源优先级 1，机器可读、寄存器/位域/中断/复位值完整；路径解析规则同 datasheet_path）"
    },
    "sdk_header_path": {
      "type": "string",
      "description": "厂商设备头文件路径（项目层，可选；S3 数据源优先级 2，寄存器/地址/中断权威，覆盖无 SVD 的芯片；路径解析规则同 datasheet_path）"
    },
    "stdperiph_lib_path": {
      "type": "string",
      "description": "MCU 标准外设库路径（项目层，S5a hardware-initializer 使用；以 platforms/ 开头时相对根目录，否则相对项目目录；留空时按 platforms/<platform>/sdk/std_periph_lib/ 约定自动发现）"
    },
    "output_dir": {
      "type": "string",
      "description": "输出目录（项目层，相对目标工程目录 App/BootLoader，默认 outputs/）"
    },
    "eda_tool": {
      "type": "string",
      "enum": ["altium", "kicad", "pdf"],
      "description": "EDA 工具/解析器类型（项目层，可选；缺省时按原理图扩展名自动判断，pdf 对应 PDF 原理图输入）"
    }
  },
  "additionalProperties": true
}
