{
  "platform": "stm32f103zet6",
  "project": {
    "build_target": "App",
    "build_system": "keil",
    "architecture": "layered",
    "rtos": "none",
    "flash_offset": 0,
    "flash_tool": "jlink",
    "power": {
      "enabled": false
    },
    "inputs": {
      "functional_spec": "docs/智能环境监测仪功能规格书.md"
    }
  },
  "schematic_path": "schematic/WarShip STM32F1_V3.4_SCH.pdf",
  "datasheet_path": "platforms/stm32f103zet6/datasheets/STM32F103ZET6.pdf",
  "datasheet_secondary_path": "platforms/stm32f103zet6/datasheets/STM32F10x_Reference_Manual.pdf",
  "svd_path": "platforms/stm32f103zet6/svd/STM32F103xx.svd",
  "sdk_header_path": "platforms/stm32f103zet6/sdk/cmsis/stm32f10x.h",
  "stdperiph_lib_path": "platforms/stm32f103zet6/sdk/std_periph_lib",
  "output_dir": "outputs/"
}
